{
  "$schema": "https://json-schema.org/draft/2020-12/schema",
  "title": "AI coding task contract",
  "type": "object",
  "additionalProperties": false,
  "required": [
    "objective",
    "scope",
    "acceptance_criteria",
    "approval_required"
  ],
  "properties": {
    "objective": {
      "type": "string",
      "minLength": 1
    },
    "scope": {
      "type": "object",
      "additionalProperties": false,
      "required": [
        "allowed_paths",
        "forbidden_actions"
      ],
      "properties": {
        "allowed_paths": {
          "type": "array",
          "items": {
            "type": "string"
          },
          "minItems": 1
        },
        "forbidden_actions": {
          "type": "array",
          "items": {
            "type": "string"
          }
        }
      }
    },
    "acceptance_criteria": {
      "type": "array",
      "items": {
        "type": "string"
      },
      "minItems": 1
    },
    "approval_required": {
      "type": "array",
      "items": {
        "type": "string"
      }
    }
  }
}
